{
 "$schema":"https://json-schema.org/draft/2020-12/schema","$id":"https://example.local/schemas/matching/matching-policy.schema.json","type":"object","additionalProperties":false,
 "required":["schema_version","kind","policy_id","policy_registry_version","catalog_record_ids","catalog_priority","brands","max_match_level","catalog_needs_review"],
 "properties":{"schema_version":{"const":"1.0.0"},"kind":{"const":"matching_policy"},"policy_id":{"type":"string","minLength":1},"policy_registry_version":{"const":"pilot-1.0.0"},"catalog_record_ids":{"type":"array","uniqueItems":true,"items":{"type":"string","minLength":1}},"catalog_priority":{"type":"array","uniqueItems":true,"items":{"type":"string","minLength":1}},"brands":{"type":"object","additionalProperties":false,"required":["include","exclude","preferred","unknown"],"properties":{"include":{"type":"array","uniqueItems":true,"items":{"type":"string"}},"exclude":{"type":"array","uniqueItems":true,"items":{"type":"string"}},"preferred":{"type":"array","uniqueItems":true,"items":{"type":"string"}},"unknown":{"enum":["allow","exclude"]}}},"max_match_level":{"enum":["exact","equivalent","alternative"]},"catalog_needs_review":{"enum":["exclude","manual_only"]}}
}
