{
  "schema_version": "1.0.0",
  "kind": "matching_policy",
  "policy_id": "golden-policy",
  "policy_registry_version": "pilot-1.0.0",
  "catalog_record_ids": [
    "record-main"
  ],
  "catalog_priority": [
    "record-main"
  ],
  "brands": {
    "include": [],
    "exclude": [],
    "preferred": [],
    "unknown": "allow"
  },
  "max_match_level": "alternative",
  "catalog_needs_review": "exclude"
}
